<!ELEMENT inscripcio (equip+)> 
<!ELEMENT equip (jugadors)> 
<!ATTLIST equip nom CDATA #REQUIRED> 
<!ELEMENT jugadors (jugador+)> 
<!ELEMENT jugador (nom, any, rols)> 
<!ELEMENT nom (#PCDATA)> 
<!ELEMENT any (#PCDATA)> 
<!ELEMENT rols (rol+)> 
<!ELEMENT rol (#PCDATA)>